33,FR,1,,Paris,Boulogne-Billancourt,Île-de-France,,Primary Paris region code
33,FR,2,,Lille,Rouen,Hauts-de-France,Normandie,Northern and Northwestern zone
33,FR,3,,Strasbourg,Reims,Grand Est,,Northeastern zone adjoining Germany and Belgium
33,FR,4,,Lyon,Grenoble,Auvergne-Rhône-Alpes,Provence-Alpes-Côte d’Azur,Southeastern zone including Rhône valley and Alps
33,FR,5,,Bordeaux,Toulouse,Nouvelle-Aquitaine,Occitanie,Southwestern zone spanning Atlantic to Pyrenees
33,FR,6,,Nice,Cannes,Provence-Alpes-Côte d’Azur,,Mobile numbers legacy block
33,FR,7,,Marseille,Montpellier,Occitanie,Provence-Alpes-Côte d’Azur,Second mobile number block
33,FR,8,,Nancy,Metz,Grand Est,,Non-geographic services (toll-free and shared-cost ranges vary)
33,FR,9,,Nantes,Rennes,Pays de la Loire,Bretagne,VoIP and non-geographic allocations